{
  "$schema": "./play-legal-readiness.schema.json",
  "schemaVersion": 1,
  "checkpoint": "CP27",
  "lastReviewedOn": "2026-07-15",
  "readinessStatus": "proposed",
  "product": {
    "appName": "Grogoni",
    "playDeveloperName": null,
    "legalEntityName": null,
    "registeredAddress": null,
    "countryOfRegistration": null,
    "registrationNumber": null
  },
  "contacts": {
    "supportEmail": null,
    "privacyEmail": null,
    "legalEmail": null,
    "contactVerificationStatus": "pending"
  },
  "legalDocuments": {
    "privacyPolicyUrl": "https://grogoni.com/privacy",
    "privacyPolicyStatus": "draft",
    "privacyPolicyEffectiveOn": null,
    "termsUrl": "https://grogoni.com/terms",
    "termsStatus": "draft",
    "termsEffectiveOn": null,
    "legalApprovalReference": null
  },
  "accountDeletion": {
    "externalRequestUrl": "https://grogoni.com/account-deletion",
    "inAppPath": "Account Settings > Delete account",
    "authenticationRequired": true,
    "androidAppRequired": false,
    "requestPathImplemented": true,
    "recoveryPeriodDays": 30,
    "associatedDataIncluded": true,
    "lawfulRetentionDisclosed": true,
    "fulfillmentRunbookStatus": "pending",
    "serviceProviderDeletionStatus": "pending",
    "operationsOwner": null,
    "privacyOwner": null
  },
  "policyBaseline": {
    "verifiedOn": "2026-07-15",
    "accountDeletionSource": "https://support.google.com/googleplay/android-developer/answer/13327111",
    "userDataSource": "https://support.google.com/googleplay/android-developer/answer/10144311",
    "revalidateBeforeSubmission": true
  },
  "approval": {
    "approvedBy": null,
    "approvedOn": null,
    "changeRecord": null
  }
}
